<?xml version="1.0" encoding="ISO-8859-1"?>

<!ELEMENT FLExTransTestbed (testbeds)>
<!ATTLIST FLExTransTestbed source_direction (ltr|rtl) "ltr"
                           target_direction (ltr|rtl) "ltr">

<!ELEMENT testbeds (testbed+)>

<!ELEMENT testbed (tests)>
<!ATTLIST testbed  n CDATA #IMPLIED>

<!ELEMENT tests (test+)>

<!ELEMENT test (sourceInput, targetOutput)>
<!ATTLIST test id CDATA #IMPLIED 
               is_valid (yes|no) #IMPLIED
               invalidReason CDATA #IMPLIED> 
 
<!ELEMENT sourceInput (lexicalUnits)>
<!ATTLIST sourceInput origin CDATA #IMPLIED> 

<!ELEMENT lexicalUnits (lexicalUnit+)>

<!ELEMENT lexicalUnit (headWord, senseNum, grammaticalCategoryTag, otherTags)>

<!ELEMENT headWord (#PCDATA)>

<!ELEMENT senseNum (#PCDATA)>

<!ELEMENT grammaticalCategoryTag (#PCDATA)>

<!ELEMENT otherTags (tag*)>

<!ELEMENT tag (#PCDATA)>

<!ELEMENT targetOutput (expectedResult, actualResult)>

<!ELEMENT expectedResult (#PCDATA)>

<!ELEMENT actualResult EMPTY>
